Name	title	coding
t3_jygnh6	Here’s when Biden’s win becomes official — and how Trump is trying to prevent that | With key deadlines looming, derailing the certification of results is part of the president’s strategy	SE
t3_jxwqi6	'Call his bluff': Edward Norton lays out poker-style Trump analysis we never expected	O
t3_jxz6rl	White Nationalist Appointed by Trump to Holocaust Commission Praised Jeffrey Epstein for Not Being “a Pussy”	O
t3_jyi6td	Trump steps on Michigan lawmakers' message in tweets after meeting	SE
t3_jxthva	Georgia Secretary of State Certifies Biden’s Win After Audit	GR
t3_jycskf	Paris agreement gets 'new lease on life' under Biden, climate advocates say	WA
t3_jxrln3	Hoyer on Trump election challenges: 'I think this borders on treason'	SE
t3_jyek1t	Trump’s last-ditch efforts to overturn results fail to make dent in Biden victory	SE
t3_jxrbox	Republican Senator Lamar Alexander urges Trump to begin Biden transition	SE
t3_jyee44	Trump to lose @POTUS Twitter account on January 20	O
t3_jxs3ay	Trump Camp Outraged Georgia Recount Counted The Votes	GR
t3_jyfrde	Senator Shirkey and Speaker Chatifeld’s names projected on Trump International Hotel	O
t3_jy3a7r	After Trump meeting, Michigan GOP lawmakers affirmed Biden will win the state and urged Trump to focus on the COVID-19 pandemic currently ravaging the US	O
t3_jyi1mt	"""Trump campaign """"seeking to disenfranchise Black voters"""" with election fraud claims: lawsuit"""	SE
t3_jycumy	How Members of Anti-Immigrant Extremist Groups Have Worked Closely with — and Joined — the Trump Administration	GI
t3_jye9pq	What to make of more than 70m Americans who voted for Trump? — As of today, 73,781,603 people voted for Trump, which amounts to 47.2 percent of the total votes counted.	O
t3_jygf1z	Biden could announce Cabinet picks as soon as next week	WA
t3_jyih12	Yes, Trump Is (Still) Engaged in an Attempted Coup; and Yes, It Might Lead to a Constitutional Crisis and a Breaking Point	SE
t3_jyhazf	Trump's monumental sulk: president retreats from public eye as Covid ravages US	O
t3_jya79l	People Think Mnuchin Accidentally Said Trump Admin’s Most Honest Thing About COVID-19	O
t3_jxqqb8	Ivanka Trump’s Rage-Tweets About Ongoing Tax Fraud Investigations Have Serious Potential to Hurt Her Legal Defense	TI
t3_jyeh3g	Trump’s last-ditch efforts to overturn results fail to make dent in Biden victory	SE
t3_jyi5ye	Trump goes golfing in middle of G20 summit	O
t3_jygf7w	Twitter will hand @POTUS account to Biden on Inauguration Day	O
t3_jybvbl	Analysis: With silence, GOP enables Trump's risky endgame	SE
t3_jy5c91	Trump Got Tricked by a Twitter Troll Posing as His Sister	O
t3_jy09dz	Opinion: Hold President Trump accountable for his misdeeds	O
t3_jxq0yf	Biden Must Keep His Word and Allow Investigations of Trump to Proceed	WA
t3_jycvon	Twitter to hand over @POTUS account to Biden on January 20	O
t3_jxuc2q	Trump Is No Longer the Problem. His Army of Followers Is.	O
t3_jygps8	Trump nominee's long road to Fed may be dead end	O
t3_jyhbq0	Biden faces a race against the clock for U.S. to rejoin Iran nuclear deal	WA
t3_jxxrc7	Georgia secretary of state certifies election results that show state’s voters chose Joe Biden for president	GR
t3_jxqskc	Michigan Republican leader is meeting with Trump at White House to discuss coup	SE
t3_jy4ekt	Twitter says it’s handing @POTUS account over to Joe Biden on Inauguration Day	O
t3_jxpd0y	Georgia Secretary of State to certify election for Biden	GR
t3_jxvr8r	Biden is considering making Merrick Garland, denied Supreme Court seat, the attorney general	WA
t3_jyeey7	Biden to work to end executions as government sets 3 more	WA
t3_jxotoe	Trump’s lawsuits plagued by spelling errors: ‘I’ve never seen an election lawyer handle a case as poorly as Giuliani has’	SE
t3_jxovi4	Latinas for Trump founder unseated Florida Democrat after ‘shadow candidate’ with his surname entered the race	SE
t3_jybm3w	Trump maintains unproven 'massive' fraud claim after meeting with Michigan lawmakers	SE
t3_jy834q	Trump Owned By Parody Twitter Account He Apparently Believed Was His Sister’s	O
t3_jxtupb	'Call His Bluff': Edward Norton's Viral Message On Trump	O
t3_jxxh0e	Detroit asks judge to sanction Trump campaign for spreading 'disinformation'	O
t3_jygqmu	Republicans demand Michigan delay certifying Biden win for ‘audit’ of Detroit vote	O
t3_jxuleo	It’s time for everyone to pick a side: America or President Trump	O
t3_jy2x8h	Michigan election staff recommend certification of Biden win	O
t3_jxszoj	Federal Judge Strikes DOJ from the Docket in E. Jean Carroll’s Case Against Donald Trump	SE
t3_jya718	Blocked by Trump, Biden forced to use transition workarounds	SE
t3_jxqenc	Trump's emotional state is 'quite fragile' after election loss	O
t3_jxw9t2	After Years of Watching ‘Trump Show,’ TV News Starts to Turn it Off	O
t3_jxogw4	Trump lawyers filed a motion in Pennsylvania to clarify they only want to block the state from certifying results of the presidential elections, not any other races on the same ballot	SE
t3_jyhe14	Trump tells G20 leaders he wants to work with them ‘for a long time’	O
t3_jya72i	Two weeks after Biden named President-elect, Trump faces stinging setbacks	WA
t3_jy9clr	Trump wanted to bomb Iran — and still could — leaving Biden to pick up the pieces	WA
t3_jyfexo	Biden faces a race against the clock for U.S. to rejoin Iran nuclear deal | KTAB	WA
t3_jyb540	Where and why President Trump’s election challenges are falling flat in court: explainer	SE
t3_jyf3ye	Biden wades into coronavirus relief fight	WA
t3_jyd1x8	‘Something very historical’: Push for diverse Biden Cabinet	WA
t3_jycmh4	A destructive legacy: Trump bids for final hack at environmental protections	O
t3_jy4hqf	Facing an Election Loss, President Donald Trump Turns to Raw Political Power to Try to Bend the Outcome	SE
t3_jy2hvv	Trump lawyers mix up Michigan and Minnesota in latest court filing fail	SE
t3_jycft4	The Memo: Trump plows ahead with efforts to overturn election	SE
t3_jxsoge	Biden campaign: Trump efforts to derail Michigan election results an 'abuse of office'	SE
t3_jxntgi	An anonymous group of top US CEOs said they would hold off acting against Trump until after the Georgia recount. It's done.	O
t3_jxnig4	Obama joked that Trump might have to get dragged out of the White House by Navy SEALs if he keeps refusing to concede	SE
t3_jyf2rb	Twitter will hand @POTUS account to Joe Biden on Inauguration Day	O
t3_jyh1d4	Biden could announce Cabinet picks as soon as next week	WA
t3_jxtlmq	Georgia secretary of state certifies election results, making Biden's victory official	GR
t3_jxp52z	Tucker Carlson: Trump lawyer 'got angry' when pressed for evidence of voter fraud	SE
t3_jxqlnp	Mitt Romney on Trump: ‘It is difficult to imagine a worse, more undemocratic action by a sitting American President’	O
t3_jxztlz	The Trump campaign allegedly mixed up Michigan and Minnesota in its election lawsuit	SE
t3_jxqij2	Trump’s Lawyer Sidney Powell Is Hardcore QAnon: Her performance at Thursday's press conference was virtually a recitation of QAnon’s greatest hits.	O
t3_jy9egl	A Biden Administration Can Raise Wages and Give Workers More Power — If It Wants To	WA
t3_jygux6	Analysis | The Pa. county that explains how Biden won big while other Democrats struggled	O
t3_jxp6a0	An attorney leading Trump's attempt to subvert the election results is a longtime QAnon supporter	O
t3_jyhm4p	Op-Ed: Why Biden should look beyond the usual pool for his Cabinet appointments	WA
t3_jy2oau	‘It cannot be done’: Biden lawyer says Michigan electoral plot would be unconstitutional	SE
t3_jxo81v	Obama says all Americans ‘should be troubled’ by Trump’s efforts to subvert democracy. ‘I’m less surprised by Donald Trump doing this, he has shown, you know, only a flimsy relationship with the truth,' says Obama	O
t3_jy91dn	The Damage Trump Could Do Before the Inauguration - Some of his methods would be immediately evident; others, hidden.	SE
t3_jxpo6l	GA secretary of state: I'm a proud Trump supporter but numbers don't lie	GR
t3_jydyix	The Major Difference Between Black Male and Female Voters — Black male turnout for Trump wasn’t indicative of the president’s successful outreach efforts, but rather the long-standing relationship between this voting bloc and the GOP.	O
t3_jybdhg	Why Kemp formalized Georgia’s election despite Trump’s pushback	O
t3_jyb15a	U.S. exits Open Skies treaty Sunday, but could Biden undo Trump's withdrawal?	WA
t3_jxva3c	"""Edward Norton Lays Out Trump's """"Desperate Endgame"""" Using Metaphor of Failed Poker Hand — """"The core of it is that he knows he’s in deep, multi-dimensional legal jeopardy and this defines his every action,"""" says the actor."""	O
t3_jxn3k4	Trump reportedly told an ally he knows he lost the 2020 election but wants revenge on Democrats for disputing his 2016 win	O
t3_jybgkx	Op-Ed: How Biden can restore U.S. global leadership after Trump's retreat from international institutions	WA
t3_jyejvj	Lara Trump reportedly mulling 2022 Senate run in North Carolina	O
t3_jy1nhy	Biden vows to work against ‘intolerable’ violence against transgender people	GI
t3_jy2yyj	Rep. Alexandria Ocasio-Cortez, expanded 'Squad' demand Biden deliver on Green New Deal	WA
t3_jxxwei	Biden’s frontrunners to replace Kayleigh McEnany as press secretary are both black women	WA
t3_jy2a6s	Trump bid to overturn vote crashes into wall of deadlines | On the heels of Georgia’s official recognition of Joe Biden’s victory, a gauntlet of other certifications in the coming days could deal a crushing blow to the president.	SE
t3_jxou52	"""GOP Sens. Romney and Sasse condemn Trump's election challenges, """"We are a nation of laws, not tweets"""""""	O
t3_jyibg1	Trump addresses virtual G-20 summit, heads out before session on pandemic	O
t3_jxumkw	Happy birthday, Joe: 78-year-old Biden to be oldest US president to take office	O
