Name	title	coding
t3_jyczbo	Saturday Morning Political Cartoon Thread	Non-candidate
t3_jya80e	Failed GOP candidate who denounced Pete Buttigieg’s “homo-ocracy” gets COVID after claiming immunity	Non-candidate
t3_jyac3z	Judge tosses last election lawsuit in Arizona	Non-candidate
t3_jy9mmm	"GOP Senators Get Stark Reminder Of Their Previous ""Let The Voters Decide"" Demands"	Non-candidate
t3_jyctfz	Newsmax and OANN are telling lies about the election as more people tune in	Non-candidate
t3_jybneh	Oligarch of the Month: Kelly Loeffler	Non-candidate
t3_jygiga	A bipartisan group of Georgia teens is trying to flip the Senate by enlisting thousands of students to vote in the January runoffs	Non-candidate
t3_jy9503	Kelly Loeffler marketed derivatives during Great Recession at world's most notorious tax haven	Non-candidate
t3_jyabpe	'Looks Like the Crazy Lady Has Logged On': Rep. Ilhan Omar Welcomes QAnon Conspiracy Theorist Marjorie Taylor Greene to Congress	Non-candidate
t3_jyabs2	The Founders didn’t prepare for a president who refuses to step down, historians say	Non-candidate
t3_jyf2be	Georgia Senator David Perdue Privately Pushed for a Tax Break for Rich Sports Team Owners: It’s unclear why Senator Perdue was interested in tax regulation that would impact only a tiny set of the richest Americans.	Non-candidate
t3_jybiph	Arizona turnout proves power of Native vote	Non-candidate
t3_jyh85t	CDC: Sturgis motorcycle rally blamed for coronavirus spread in Minnesota	Non-candidate
t3_jygu45	Susan Rice: 'This is most irresponsible leadership during a transition' ever seen	Non-candidate
t3_jya4fz	US Congress members demand halt to deportations of women who accused gynecologist of abuse	Non-candidate
t3_jyf6mo	Treasury Secretary Steven Mnuchin flubs and says the White House is 'working on a mass distribution of the virus'	Non-candidate
t3_jy41i7	AOC calls out Mitch McConnell for Senate's Thanksgiving break without stimulus deal	Non-candidate
t3_jybr0t	Majority of voters now feel hopeful about the state of the U.S., poll says	Non-candidate
t3_jyfjqa	How Do You Govern When Half The Country Is Trapped In A Disinformation Bubble? | All In | MSNBC	Non-candidate
t3_jychxg	Grassley misses Senate vote; first time in 27 years	Non-candidate
t3_jyffh5	Democrats' New Plan To Win Georgia's Crucial Senate Seats In A Pandemic Is To Actually Knock On Doors	Non-candidate
t3_jyd2yd	Last challenge to Maricopa County election results tossed by judge	Non-candidate
t3_jygldo	No, State Legislatures May Not Reverse the Result of the Election	Non-candidate
t3_jydrnk	Lawyers for U.S. Homeland Security whistleblower get security clearances	Non-candidate
t3_jyf46l	Abrams’ group funds grassroots efforts to win Georgia’s Senate runoffs	Non-candidate
t3_jygxnx	Nearly 200 legislators have tested positive for coronavirus nationwide and four have died as GOP flouts rules	Non-candidate
t3_jyctkg	The US Could Soon Ban the Selling of Carrier-Locked Phones	Non-candidate
t3_jydwzy	CEO Over VOA Acted Unconstitutionally In Pursuing Bias Claims, U.S. Judge Rules	Non-candidate
t3_jybpms	Voters support more police oversight in cities across U.S., including in California	Non-candidate
t3_jyd9hi	Outrage in Black community over claims of voter fraud in US election	Non-candidate
t3_jychq7	'It's a big, scary mess': 12 million Americans to lose jobless aid after Christmas if Congress fails to act	Non-candidate
t3_jy24nm	'Bring it on, I'm not backing down': Arizona top election official Katie Hobbs holds fast against attempts to undermine the state's election	Non-candidate
t3_jxyrve	'In Breaking the Senate, We Are Abandoning Our People': Watch AOC Excoriate McConnell on House Floor	Non-candidate
t3_jxy696	It’s Time to Take Away Rudy’s Law License	Non-candidate
t3_jyh01o	Black women helped push Democrats to the finish line in Georgia. Here's how they can do it again	Non-candidate
t3_jyb06y	In cities nationwide, voters sanction more police oversight	Non-candidate
t3_jy3zq2	Maricopa County Board of Supervisors vote unanimously to certify election results	Non-candidate
t3_jy706r	Georgia Sen. David Perdue declines to debate opponent ahead of January 5 runoff	Non-candidate
t3_jyfahb	Republicans ask Michigan election board to delay certification for two weeks, audit Detroit votes	Non-candidate
t3_jxwmym	Lock the motherfucker up	Non-candidate
t3_jy8mqk	Fact check: Claims linking Dominion Voting Systems to Democrats are wrong or misleading	Non-candidate
t3_jye1m4	Many GOP lawmakers shrug off Statehouse mask-wearing rules	Non-candidate
t3_jygrxg	Powerful Ohio utilities regulator steps down following FBI search of his home	Non-candidate
t3_jygjcl	South Dakota Gov. Kristi Noem Ignores CDC Advice On Thanksgiving Gatherings	Non-candidate
t3_jybfn6	More Republicans Distrust This Year’s Election Results Than Democrats After 2016	Non-candidate
t3_jxw7eb	22 million jobless, Senate Republicans go home for Thanksgiving without passing aid	Non-candidate
t3_jyf5m1	One In Three Americans Didn't Vote. Should We Force Them To Next Time?	Non-candidate
t3_jyh180	Reverend who led Halloween march to the polls in North Carolina charged with felony assault	Non-candidate
t3_jyb13e	Georgia Governor calls for Audit after state certifies result	Non-candidate
t3_jy1vtb	Maricopa County Board of Supervisors certify 2020 general election results	Non-candidate
t3_jy108r	Judge denies bid to halt Nevada from certifying election results	Non-candidate
t3_jyecdj	State, national GOP seek to delay certification of election results	Non-candidate
t3_jyd9y8	Wisconsin GOP election commissioner praised right-wing provocateur who promoted voter fraud conspiracies	Non-candidate
t3_jyhhg0	Texas State Board of Education makes changes to Sex-Ed classes, excluding LGBTQ youth	Non-candidate
t3_jyf5jy	Hawaii officials are preparing to immunize 44,000 high-risk residents next month if COVID-19 treatment is approved	Non-candidate
t3_jxt6zy	Republicans would have been ‘screaming their heads off’ if Democrats tried to overturn the 2016 election: Fox’s Guy Benson	Non-candidate
t3_jyfrcz	RNC chair urges Michigan board to pause certification of election results	Non-candidate
t3_jybwzd	There are so many ways we could have done better	Non-candidate
t3_jyhkkr	12 million Americans could lose crucial unemployment benefits just after Christmas	Non-candidate
t3_jxz416	GSA Administrator Emily Murphy Alive, Mad We Emailed Her| The government bureaucrat holding up the peaceful transfer of presidential power refuses to explain herself.	Non-candidate
t3_jy8qem	Progressive initiatives popular even in red states	Non-candidate
t3_jxqsmg	Lindsey Graham’s Alleged Attempt to Toss Georgia Ballots Is Felony Election Fraud	Non-candidate
t3_jygb0p	The Latest: Midwest governors: Stay home for Thanksgiving	Non-candidate
t3_jxq07k	Florida’s Rick Scott tests positive for coronavrius	Non-candidate
t3_jxtde6	Nevada becomes first state to protect same-sex marriage in its constitution	Non-candidate
t3_jygn0t	COVID-19 vaccines are almost ready to be distributed. Who gets them after health care workers? Here's a list.	Non-candidate
t3_jygj51	GOP seeks certification delay, state recommends approval	Non-candidate
t3_jybmr4	Mnuchin’s Inglorious Endgame	Non-candidate
t3_jycv9b	Andrew Cuomo to receive International Emmy for virus briefings	Non-candidate
t3_jyhv3n	Many GOP lawmakers shrug off statehouse mask-wearing rules	Non-candidate
t3_jxyi5y	FTC asks court to force Bannon to testify on Cambridge Analytica scandal	Non-candidate
t3_jxp91y	David Perdue Hit With More Allegations of Shady Stock Transactions	Non-candidate
t3_jyebck	White House largely silent on health precautions for Thanksgiving	Non-candidate
t3_jyh348	Fact checking misleading claims over the Georgia recount	Non-candidate
t3_jydbpt	Orlando Hall’s Execution Continues Administration’s Unprecedented Blood Lust at the Expense of Justice	Non-candidate
t3_jyd23u	It’s time for California to end the racist and expensive war on drugs. Here’s how	Non-candidate
t3_jy0twx	GOP wants audit before certifying Michigan election. Law won’t allow it.	Non-candidate
t3_jy6dhj	Apple is lobbying against a bill aimed at stopping forced labor in China	Non-candidate
t3_jyeder	Many GOP Lawmakers Shrug off Statehouse Mask-Wearing Rules	Non-candidate
t3_jyd3jv	Shutdown deadline nears as White House, Congress tangle over VA funding	Non-candidate
t3_jyib9d	Republican leaders ask Michigan election board to delay certification of results, in latest GOP effort to cast doubt on the vote	Non-candidate
t3_jxzsnh	"Iran says Rudy Giuliani is ""melting in every sense of the word"" after controversial press conference"	Non-candidate
t3_jxrlx6	Rudy Giuliani suggests cutting heads of Democrats in Fox interview after disastrous press conference	Non-candidate
t3_jxnvqs	Rudy Giuliani said someone should 'cut the head off' the Democrats while making a throat-slashing gesture on Fox News	Non-candidate
t3_jyie1r	Mike Kelly, Sean Parnell Request To Declare Mail-In Voting Unconstitutional In Pennsylvania, Deny Results From 2020 Election Mail-In Ballots – CBS Pittsburgh	Non-candidate
t3_jxw2eg	Nearly 75 Percent of Americans Say They Plan to Stay Home This Thanksgiving Amid Surge of COVID Cases: Poll	Non-candidate
t3_jy21zh	Nevada judge denies request to halt state certification of election results	Non-candidate
t3_jxn4qo	Kelly Loeffler's disclosures appear to omit the holding company that operates her private jet | If the Georgia senator knowingly falsified or omitted information from her disclosure forms, that's a crime	Non-candidate
t3_jxxqx3	Sidney Powell: I Didn’t Provide Evidence to Tucker Because He Was ‘Rude’	Non-candidate
t3_jxx7sc	Loeffler faces ethics complaints for soliciting donations in US Capitol	Non-candidate
t3_jyaguq	1 America, 1 Pandemic, 2 Realities	Non-candidate
t3_jy3jkq	U.S. Army Didn't Seize Election Servers in Germany	Non-candidate
t3_jxzvig	CNN Reporter Fires Back at Kayleigh’s ‘Activists’ Snipe: You’re ‘Not Doing Your Job!’	Non-candidate
t3_jxwn7x	Andrew Giuliani tests positive for Covid-19, one day after attending news conference	Non-candidate
t3_jy684m	Rudy Giuliani Is a Hot Mess	Non-candidate
t3_jycvv9	Loren Culp, refusing to concede Washington gubernatorial race, turns on top Republicans	Non-candidate
t3_jyfau4	When Coups Come Home	Non-candidate
t3_jygj9b	Some New Mexico essential business close due to virus spike	Non-candidate
t3_jxo9n1	Georgia Senator David Perdue Privately Pushed for a Tax Break for Rich Sports Teamowners	Non-candidate
t3_jyd2lg	Los Angeles County on the Brink of New Health Orders Amid Surge in Covid Cases	Non-candidate
t3_jxq5kt	Enough With the ‘Please Be Centrist, Joe’ Op-Eds	Non-candidate
t3_jxzjux	Mr. President, it’s time to pack	Non-candidate
t3_jy79zd	Despite court challenge , Wisconsin governor renews mask mandate	Non-candidate
t3_jygsfc	Top mayoral candidate admonishes new voting system amidst efforts to delay it	Non-candidate
t3_jy2v1r	Ben Carson says he was 'desperately ill' from Covid but is now 'out of the woods'	Non-candidate
t3_jyevov	Trump Supporters in Georgia Threaten to Destroy GOP, Boycott Runoff Elections	GR
t3_jyd4va	Trump admits Michigan Congressmen met to discuss coup	SE
t3_jybzw2	Trump Organization's consulting payments to Ivanka Trump are focus of NY tax probe	TI
t3_jybvym	Biden's lead over Trump surpasses 6M votes as more ballots are tallied	WA
t3_jyat09	Michigan group sues Trump campaign for alleged mass voter suppression	SE
t3_jycwb6	Meet Pennsylvania’s anger translator, and Donald Trump’s worst nightmare	O
t3_jydai0	Bypassing McConnell: Democrats push Biden to aggressively use executive power	WA
t3_jyebbg	GOP asks Michigan not to certify election results, citing ‘irregularities’ | The move follows speculation that Trump is seeking to persuade Michigan Republicans to override election results	SE
t3_jy9p0n	Trump's defeat by Joe Biden has triggered a huge wave of relief among the United States' European allies	WA
t3_jyacke	"""Rudy Giuliani's quixotic frenzy has observers wondering if he may need Trump's protection | """"One explanation? He needs a pardon and he's trying to earn it,"""" a CNN analyst says"""	O
t3_jyarxl	Neal Katyal: All of Trump’s criminal immunity expires in about 60 days	O
t3_jybdm3	Trump Takes Another L: Michigan GOPers Say No To Election Steal	SE
t3_jy8q5v	NJ Democrat Calls for Rudy Giuliani, Other Trump Attorneys to be Disbarred	O
t3_jyfn88	Trump tweets about election results and skips session on pandemic during G20	O
t3_jycgfg	Shame the Random, Unknown Government Officials Aiding Trump’s Coup Attempt	SE
t3_jyaacw	Kayleigh McEnany’s Latest Trump Lie Is Firmly Debunked In Viral Video	O
t3_jyg71f	NAACP Federal Suit: Trump Violated Voting Rights Act	O
t3_jyamtf	Barack Obama: ‘Donald Trump and I tell very different stories about America’	O
t3_jyd46w	Trump has longstanding history of calling elections 'rigged' if he doesn’t like the results	SE
t3_jyeb75	Joe Biden Owes His Victory to the Left. Organizers, not consultants, delivered key states like Pennsylvania, Arizona and Georgia.	WA
t3_jy93rj	Dear Trump supporters: Those who egg on the president now, given the damage he does to America, are truly reprehensible	O
t3_jyehxb	No, Venezuelan communists did not interfere in the election. Yes, Trump’s legal team claimed that.	SE
t3_jyegwu	Wall Street Journal Bails on Trump’s ‘Conspiracy Theory,’ Says Giuliani is Not a ‘Serious Practicing Attorney	SE
t3_jya174	Judge slaps down Trump appointee who has sought to reshape Voice of America and related agencies	O
t3_jybo0y	Yes, Donald Trump claimed fraud after the 2016 Iowa caucuses	O
t3_jyc40v	With Trump sabotaging American democracy, the Russians don’t need to interfere	O
t3_jy9p2e	Steve Mnuchin Is Doing His Part to Sabotage the Biden Administration on His Way out the Door	SE
t3_jygbaz	GOP Michigan ex-governor says state board will certify Biden winner over 'bully' Trump	O
t3_jyd52j	Twitter to Meet With Biden Transition Team on Transfer of Social Media Accounts From Trump Admin	O
t3_jybnek	Trump tries to drum out GOP election officials who won’t play his games — Georgia Secretary of State Brad Raffensperger's family has received threats and he expects a primary challenge in 2022	SE
t3_jyevyz	Biden's popular vote lead over Trump stretches to more than 6m	WA
t3_jy3mhv	Biden's margin of victory over Trump surpasses 6 million votes	WA
t3_jy9asn	Let's count the ways Donald Trump has tried to subvert this election, shall we?	SE
t3_jyftsx	Trump’s Pennsylvania Suit is ‘Incoherent Conspiracy,’ Voters Say	SE
t3_jy58b1	Senators who urged ‘voters to decide’ impeachment won’t admit Trump lost the election	O
t3_jyfk0g	"""Sen. Bernie Sanders: """"Thank God"""" Joe Biden won the election"""	WA
t3_jygnzl	A group of Michigan voters are suing the Trump campaign for disenfranchising Black voters, lawsuit alleges	SE
t3_jye7eu	"""In 'Tremendous Rebuke' of Trump Appointee, Federal Judge Bars US Media Agency Head From Interfering in News Coverage | """"Michael Pack has repeatedly and intentionally violated the First Amendment rights of VOA journalists."""""""	O
t3_jy30hq	U.S. Sen. Marsha Blackburn, a Trump ally, refers to Biden as 'president-elect'	WA
t3_jybv6o	Will Trump Screw Up Republican Efforts to Hang Onto the Senate?	O
t3_jy7n7y	Conservative News Site Warns Trump: 'Concede And Move On'	SE
t3_jyfjeg	Most GOP Senators Stay Mum on Trump's Efforts to Challenge Election, After Washington Post Contacted All 53 of Them	SE
t3_jy1h8p	Twitter says it will give @POTUS account to Biden on Inauguration Day	O
t3_jyhv9o	Trump was pictured on his Virginia golf course during a coronavirus meeting for G20 leaders	O
t3_jy2k5b	Michigan attorney general ponders criminal probes of state and local officials who bend to Trump’s will on overturning election results	SE
t3_jyc5ef	Trump options narrow as Michigan backs Biden win	SE
t3_jycdqu	Why Can Trump Try To Steal The Election? Blame The Electoral College.	SE
t3_jyauqo	Conspiracy theories are Trump ‘weapons’ in desperate bid to cling to power	O
t3_jyefvb	Donald Trump says 'I won, by the way' and lashes out at Pfizer claiming it delayed news of the COVID-19 vaccine until after the election	O
t3_jy2blr	Steven Mnuchin Swears He’s Not Tanking the Economy Just to F--k Over Joe Biden: Strangely, not everyone believes him.	WA
t3_jyeldv	A new lawsuit alleges Trump’s effort to overturn Michigan’s election results disenfranchises Black voters	SE
t3_jy853m	US Chamber of Commerce chief calls on Trump to stop delaying transition to Biden presidency	SE
t3_jy0nxd	Donald Trump Jr tests positive for coronavirus	O
t3_jy0een	Rudy Giuliani's Son Potentially Exposed Most of Trump's Legal Team to COVID During RNC Press Conference	O
t3_jy06aa	After Trump meeting, Michigan GOP lawmakers say they’re not aware of any info that would change Biden’s victory in state	SE
t3_jy94n0	Trump considers targeting birthright citizenship with executive order in his last weeks in office, report says	O
t3_jyecom	Rahm Emanuel Reportedly Being Considered for Biden's Cabinet, a Choice That Would Be a Slap in the Face to Black Voters	WA
t3_jy38ap	Biden will receive @POTUS Twitter account on Jan. 20 even if Trump doesn't concede, company says	O
t3_jyhdoi	Trump tweets undermine Michigan leaders; images show Chatfield drinking at Trump hotel	O
t3_jyeurt	Merrick Garland is being considered for Attorney General in the Biden administration	WA
t3_jy2j68	Arizona’s largest county certifies Biden win over Trump	WA
t3_jyhjr0	Trump skips G20 coronavirus meeting to play golf and tweet bogus election claims	O
t3_jyg34p	Trump Using Last Days to Lock in Policies and Make Biden’s Task More Difficult	O
t3_jyh4cs	As world leaders meet to talk pandemic, Trump checks out and hits the links	O
t3_jy0o3b	Michigan and Georgia Republicans Just Crushed Trump’s Coup Dreams	SE
t3_jyca1s	The Trump campaign’s much-hyped affidavit features a big, glaring error	SE
t3_jy1qop	After Trump meeting, Michigan GOP leaders say Biden's win still stands	WA
t3_jygs2r	G20 leaders meet to discuss help for poorest nations in post-Covid world, Trump golfs	O
t3_jyf2se	Georgia GOP governor says he understands Trump's frustration, but maintains he's following state laws	GR
t3_jy46k6	Letters to the Editor: Stop Donald Trump's coup. Impeach him again	O
t3_jyhg8l	Trump appointed judges in Florida overturn ban on conversion therapy for minors	GI
t3_jy0iwa	Twitter will hand @POTUS to Biden on Inauguration Day, even if Trump doesn’t concede	O
t3_jyemqz	Donald Trump Will Lose One Of His Twitter Accounts To Joe Biden On Inauguration Day. An account the president uses to retweet his conspiracy theories and vitriol will be wiped and handed over to the Biden administration.	O
t3_jyi4xi	Impeach the president again — Removal from office wouldn’t be the goal this time. It would be to prevent Trump from running again.	O
t3_jxze94	Ivanka Trump distances self from dad’s election fraud claims as her own legal jeopardy grows	TI
t3_jyaidt	The Danger (and Ineptitude) of Trump’s Failed Coup	O
t3_jxxkww	Bernie Sanders says the 'GOP has ceased to be a political party' and 'is now a cult' for staying silent on Trump's election attacks	SE
t3_jxxiya	Trump refuses to take questions after falsely claiming he won election in first media appearance in weeks. No sitting US president has falsely claimed an election victory from the Brady Briefing Room. Until Friday	O
t3_jxz8g9	Georgia governor certifies presidential electors for Biden	WA
t3_jy9t3x	Biden will receive @POTUS Twitter account even if Trump refuses to concede	O
t3_jyc1ze	Voice of America's 5 Months Under Trump CEO: Lawsuits, Bias Claims, And A Sex Scandal	O
t3_jyby64	Business and World Leaders Move On as Trump Fights to Reverse Election | President-elect Joseph R. Biden Jr. is seizing the moment, not to aggressively confront the president he defeated, but to act presidential in his stead.	WA
t3_jy4cdz	Michigan group sues Trump campaign citing disenfranchisement of Black voters - The plaintiffs say the campaign's legal challenges to the election violated their voting rights.	SE
t3_jxwbg1	Trump accuses Pfizer and Moderna of working to stop his re-election	SE
t3_jyau1p	GOP lawmaker patience runs thin with Trump tactics	SE
t3_jy0jkm	Trump Is Still Raging Against Democracy. But It’s Time To Applaud The Tenacity Of Voters, Poll And USPS Workers	O
t3_jy38k5	CNN's Brianna Keilar rolls the tape on Donald Trump's history of baselessly claiming election fraud	SE
t3_jydi88	The Fed Could Help Cash-Strapped Cities and States. Mnuchin Has Other Ideas. | The lame-duck Treasury secretary seems to want to sabotage Biden’s ability to stave off the pandemic’s economic impacts.	WA
t3_jy8vfz	Fareed Zakaria: Trump presidency is stomping on the face of democracy forever	O
t3_jyd786	Trump supporters plan D.C. rally two days before electoral college votes are cast	O
t3_jybvp1	Twitter will give @POTUS handle to Joe Biden on Inauguration Day	O
t3_jyh7e5	Cuomo tells Biden $500 billion in stimulus funds needed to bail out states	WA
t3_jyhqa5	Trump’s failure to work with Biden is becoming more urgent as Covid spreads	O
t3_jyga4y	Judge rules against Trump global media chief after firings	O
t3_jygefw	Who needs Russia? Loudest attacks on US vote are from Trump	O
t3_jydlai	Biden to Work to End Executions as Government Sets 3 More	WA
t3_jxv4xn	More GOP Senators Have COVID Than Have Acknowledged That Joe Biden Won	O
t3_jy0zg7	Editorial: Trump’s effort to steal the election is a step toward fascism in America. If you call yourself a patriot, you can’t support it	SE
t3_jy5qo8	Biden's margin of victory widens as Trump's subversion efforts grow more frantic	SE
t3_jyfwel	Analysis: How Georgia proves Trump has no chance of winning	GR
t3_jye8sy	Latinas for Trump founder unseated Florida Democrat after seeing ‘shadow candidate’ enter race	SE
t3_jxvrvz	Nancy Pelosi calls Trump a 'psychopathic nut' as the president continues to try to overturn the election results	O
t3_jyi19h	Trump Is Staging a Comically Incompetent Coup — It would almost be possible to laugh at this debacle if the stakes weren’t so serious.	SE
t3_jxv07i	Ivanka Trump: How Dare You Investigate My Father for Tax Fraud, Which He Definitely Didn’t Use Me to Commit	TI
t3_jxybf2	'Certify the Results!': Michigan Lawmakers Blasted for 'Legitimizing a Fascist Coup Attempt' by Meeting With Trump	SE
t3_jyar6j	Coronavirus updates: Donald Trump Jr. tests positive; model estimates 471k US deaths by March; Cuomo to receive International Emmy	O
t3_jy79iv	Trump’s monumental sulk: president retreats from public eye as Covid ravages US | Two weeks after his defeat, Trump has gone from always present to effectively missing, behavior that many say is an unprecedented and dangerous	O
t3_jxu6uj	Georgia certifies that Joe Biden won the recount	GR
t3_jyhutc	Obama jokes that Navy SEALs could remove Trump from the White House	SE
t3_jyht3y	Pompeo’s Grotesque Farewell Party in Israel Shows That the Trump Team Knows It's Over — Pompeo used his visit to Israel and the settlements to push forward his pet ideological project and advance his post-Trump political career.	O
t3_jye1kw	Justice Dept. meets Trump, Giuliani vote-fraud claims with silent skepticism	SE
t3_jy9z3h	Trump tries to leverage power of office to subvert Biden win	SE
t3_jxwnu3	Detroit asks judge to sanction Trump campaign for spreading 'disinformation'	O
t3_jyfwyr	GOP Sen. Blackburn Calls Biden President-Elect, but Later Takes it Back	WA
t3_jxyoqs	The Perils of Not Prosecuting Trump Joe Biden is wary of a legal reckoning against his predecessor, but to let Trump go would be to sanction future corruption.	WA
t3_jye2au	No Take Backs! Blackburn Spox Says GOPer Didn’t Mean To Call Biden President-Elect	WA
t3_jygj58	Joe Biden Turns 78 and Will Be the Oldest President — After Trump Broke the Record Right Before Him	O
t3_jxuobg	Trump's legal team seemingly didn't notice its allegation of election fraud in Michigan is based on data from Minnesota	SE
t3_jyhkqu	Judge rules against Trump global media chief after firings	O
t3_jyg473	Battered by setbacks in push to reverse Biden win, Trump persists with fraud claims	SE
t3_jxtgbd	Trump’s press secretary Kayleigh McEnany heckled in briefing: ‘When will you admit you lost?’	SE
t3_jy2fn8	President-elect Joe Biden Asks Public to Fund Transition as Trump Refuses to Concede	SE
t3_jxyws8	Republican leaders swore an oath to defend the Constitution. That means telling Trump it’s over.	O
t3_jyh2tm	Trump's 'Death Star' strategy: Forcing a fight over states' electors	SE
t3_jy8elg	Most Republicans greet Trump’s push to overturn the election with a customary response: Silence	SE
t3_jy2mf4	Anger builds in Black community over Trump’s claims of voter fraud in big cities	SE
t3_jyi47r	Trump Skips G20 Pandemic Preparedness Meeting as Covid-19 Cases Surpass 12 Million in US	O
t3_jyfd5c	I met ‘monster’ reality TV star Donald Trump 16 years ago. The reality of him has been monstrous . . .	O
t3_jyewe9	Plagued by COVID outbreaks, the meatpacking industry could be forced to change under Biden	WA
t3_jyfthv	Twitter will transfer presidential accounts to Joe Biden on Inauguration Day	O
t3_jyedlw	Biden team solicits donations to fund presidential transition as Trump administration blocks federal money	SE
t3_jxsa0k	Merrick Garland Among Biden Candidates For Attorney General, Sources Say	WA
t3_jydvyu	How Georgia's pro-Trump election chief became the bane of the GOP	O
